{
  "$schema": "https://json-schema.org/draft/2020-12/schema",
  "$id": "local-reality-body.epistemic-record.v0.1",
  "type": "object",
  "required": [
    "schema",
    "record_id",
    "body_id",
    "recorded_at_utc",
    "classification",
    "local_basis",
    "predecessor",
    "crossing",
    "observations",
    "working_content_orientation",
    "source_relations",
    "uncertainty",
    "record_posture",
    "explicit_non_effects"
  ],
  "properties": {
    "$schema": {"type": "string"},
    "schema": {"const": "local-reality-body.epistemic-record.v0.1"},
    "record_id": {"const": "RM-LOCAL-REALITY-BODY-001-EPISTEMIC-RECOVERY-CROSSING-001"},
    "body_id": {"const": "RM-LOCAL-REALITY-BODY-001"},
    "recorded_at_utc": {"type": "string"},
    "classification": {"const": "ADMITTED_BODY_LOCAL_ORIENTATION"},
    "local_basis": {"type": "object"},
    "predecessor": {"type": "object"},
    "crossing": {"type": "object"},
    "observations": {"type": "array", "minItems": 4},
    "working_content_orientation": {"type": "array", "minItems": 5},
    "source_relations": {"type": "array", "minItems": 3},
    "uncertainty": {"type": "array", "minItems": 1},
    "record_posture": {"const": "CURRENT_BODY_LOCAL_ORIENTATION"},
    "explicit_non_effects": {"type": "array", "uniqueItems": true}
  },
  "additionalProperties": false
}
